{
  "schema_version": "0.1.0",
  "generated_at": "2026-05-23T12:48:20.103803+00:00",
  "runtime_profile": "current_python",
  "packages": [
    {
      "package": "anndata",
      "distribution": "anndata",
      "import_name": "anndata",
      "declared_runtime_status": "installed",
      "ref_path": "skills/scrna/scverse/refs/packages/anndata.md",
      "version": "0.12.13",
      "status": "installed",
      "failure_reason": null,
      "waiver_reason": null
    },
    {
      "package": "bento",
      "distribution": "bento",
      "import_name": "bento",
      "declared_runtime_status": "missing",
      "ref_path": "skills/scrna/scverse/refs/packages/bento.md",
      "version": null,
      "status": "missing",
      "failure_reason": "import: ModuleNotFoundError: No module named 'bento'",
      "waiver_reason": null
    },
    {
      "package": "biolord",
      "distribution": "biolord",
      "import_name": "biolord",
      "declared_runtime_status": "missing",
      "ref_path": "skills/scrna/scverse/refs/packages/biolord.md",
      "version": null,
      "status": "missing",
      "failure_reason": "import: ModuleNotFoundError: No module named 'biolord'",
      "waiver_reason": null
    },
    {
      "package": "cell2location",
      "distribution": "cell2location",
      "import_name": "cell2location",
      "declared_runtime_status": "missing",
      "ref_path": "skills/scrna/scverse/refs/packages/cell2location.md",
      "version": null,
      "status": "missing",
      "failure_reason": "import: ModuleNotFoundError: No module named 'cell2location'",
      "waiver_reason": null
    },
    {
      "package": "cellannotator",
      "distribution": "cellannotator",
      "import_name": "cellannotator",
      "declared_runtime_status": "missing",
      "ref_path": "skills/scrna/scverse/refs/packages/cellannotator.md",
      "version": null,
      "status": "missing",
      "failure_reason": "import: ModuleNotFoundError: No module named 'cellannotator'",
      "waiver_reason": null
    },
    {
      "package": "cellcharter",
      "distribution": "cellcharter",
      "import_name": "cellcharter",
      "declared_runtime_status": "missing",
      "ref_path": "skills/scrna/scverse/refs/packages/cellcharter.md",
      "version": null,
      "status": "missing",
      "failure_reason": "import: ModuleNotFoundError: No module named 'cellcharter'",
      "waiver_reason": null
    },
    {
      "package": "cellmapper",
      "distribution": "cellmapper",
      "import_name": "cellmapper",
      "declared_runtime_status": "missing",
      "ref_path": "skills/scrna/scverse/refs/packages/cellmapper.md",
      "version": null,
      "status": "missing",
      "failure_reason": "import: ModuleNotFoundError: No module named 'cellmapper'",
      "waiver_reason": null
    },
    {
      "package": "celloracle",
      "distribution": "celloracle",
      "import_name": "celloracle",
      "declared_runtime_status": "missing",
      "ref_path": "skills/scrna/scverse/refs/packages/celloracle.md",
      "version": null,
      "status": "missing",
      "failure_reason": "import: ModuleNotFoundError: No module named 'celloracle'",
      "waiver_reason": null
    },
    {
      "package": "cellphonedb",
      "distribution": "cellphonedb",
      "import_name": "cellphonedb",
      "declared_runtime_status": "missing",
      "ref_path": "skills/scrna/scverse/refs/packages/cellphonedb.md",
      "version": null,
      "status": "missing",
      "failure_reason": "import: ModuleNotFoundError: No module named 'cellphonedb'",
      "waiver_reason": null
    },
    {
      "package": "cellrank",
      "distribution": "cellrank",
      "import_name": "cellrank",
      "declared_runtime_status": "missing",
      "ref_path": "skills/scrna/scverse/refs/packages/cellrank.md",
      "version": null,
      "status": "missing",
      "failure_reason": "import: ModuleNotFoundError: No module named 'cellrank'",
      "waiver_reason": null
    },
    {
      "package": "dandelion",
      "distribution": "dandelion",
      "import_name": "dandelion",
      "declared_runtime_status": "missing",
      "ref_path": "skills/scrna/scverse/refs/packages/dandelion.md",
      "version": null,
      "status": "missing",
      "failure_reason": "import: ModuleNotFoundError: No module named 'dandelion'",
      "waiver_reason": null
    },
    {
      "package": "decoupler",
      "distribution": "decoupler",
      "import_name": "decoupler",
      "declared_runtime_status": "missing",
      "ref_path": "skills/scrna/scverse/refs/packages/decoupler.md",
      "version": null,
      "status": "missing",
      "failure_reason": "import: ModuleNotFoundError: No module named 'decoupler'",
      "waiver_reason": null
    },
    {
      "package": "doubletdetection",
      "distribution": "doubletdetection",
      "import_name": "doubletdetection",
      "declared_runtime_status": "missing",
      "ref_path": "skills/scrna/scverse/refs/packages/doubletdetection.md",
      "version": null,
      "status": "missing",
      "failure_reason": "import: ModuleNotFoundError: No module named 'doubletdetection'",
      "waiver_reason": null
    },
    {
      "package": "dynamo",
      "distribution": "dynamo",
      "import_name": "dynamo",
      "declared_runtime_status": "missing",
      "ref_path": "skills/scrna/scverse/refs/packages/dynamo.md",
      "version": null,
      "status": "missing",
      "failure_reason": "import: ModuleNotFoundError: No module named 'dynamo'",
      "waiver_reason": null
    },
    {
      "package": "episcanpy",
      "distribution": "episcanpy",
      "import_name": "episcanpy",
      "declared_runtime_status": "missing",
      "ref_path": "skills/scrna/scverse/refs/packages/episcanpy.md",
      "version": null,
      "status": "missing",
      "failure_reason": "import: ModuleNotFoundError: No module named 'episcanpy'",
      "waiver_reason": null
    },
    {
      "package": "hotspot",
      "distribution": "hotspot",
      "import_name": "hotspot",
      "declared_runtime_status": "missing",
      "ref_path": "skills/scrna/scverse/refs/packages/hotspot.md",
      "version": null,
      "status": "missing",
      "failure_reason": "import: ModuleNotFoundError: No module named 'hotspot'",
      "waiver_reason": null
    },
    {
      "package": "infercnvpy",
      "distribution": "infercnvpy",
      "import_name": "infercnvpy",
      "declared_runtime_status": "missing",
      "ref_path": "skills/scrna/scverse/refs/packages/infercnvpy.md",
      "version": null,
      "status": "missing",
      "failure_reason": "import: ModuleNotFoundError: No module named 'infercnvpy'",
      "waiver_reason": null
    },
    {
      "package": "liana",
      "distribution": "liana",
      "import_name": "liana",
      "declared_runtime_status": "missing",
      "ref_path": "skills/scrna/scverse/refs/packages/liana.md",
      "version": null,
      "status": "missing",
      "failure_reason": "import: ModuleNotFoundError: No module named 'liana'",
      "waiver_reason": null
    },
    {
      "package": "moscot",
      "distribution": "moscot",
      "import_name": "moscot",
      "declared_runtime_status": "missing",
      "ref_path": "skills/scrna/scverse/refs/packages/moscot.md",
      "version": null,
      "status": "missing",
      "failure_reason": "import: ModuleNotFoundError: No module named 'moscot'",
      "waiver_reason": null
    },
    {
      "package": "mudata",
      "distribution": "mudata",
      "import_name": "mudata",
      "declared_runtime_status": "missing",
      "ref_path": "skills/scrna/scverse/refs/packages/mudata.md",
      "version": null,
      "status": "missing",
      "failure_reason": "import: ModuleNotFoundError: No module named 'mudata'",
      "waiver_reason": null
    },
    {
      "package": "muon",
      "distribution": "muon",
      "import_name": "muon",
      "declared_runtime_status": "missing",
      "ref_path": "skills/scrna/scverse/refs/packages/muon.md",
      "version": null,
      "status": "missing",
      "failure_reason": "import: ModuleNotFoundError: No module named 'muon'",
      "waiver_reason": null
    },
    {
      "package": "muon_tutorials",
      "distribution": "muon_tutorials",
      "import_name": "muon_tutorials",
      "declared_runtime_status": "missing",
      "ref_path": "skills/scrna/scverse/refs/packages/muon_tutorials.md",
      "version": null,
      "status": "missing",
      "failure_reason": "import: ModuleNotFoundError: No module named 'muon_tutorials'",
      "waiver_reason": null
    },
    {
      "package": "omicverse",
      "distribution": "omicverse",
      "import_name": "omicverse",
      "declared_runtime_status": "missing",
      "ref_path": "skills/scrna/scverse/refs/packages/omicverse.md",
      "version": null,
      "status": "missing",
      "failure_reason": "import: ModuleNotFoundError: No module named 'omicverse'",
      "waiver_reason": null
    },
    {
      "package": "palantir",
      "distribution": "palantir",
      "import_name": "palantir",
      "declared_runtime_status": "missing",
      "ref_path": "skills/scrna/scverse/refs/packages/palantir.md",
      "version": null,
      "status": "missing",
      "failure_reason": "import: ModuleNotFoundError: No module named 'palantir'",
      "waiver_reason": null
    },
    {
      "package": "pegasus",
      "distribution": "pegasus",
      "import_name": "pegasus",
      "declared_runtime_status": "missing",
      "ref_path": "skills/scrna/scverse/refs/packages/pegasus.md",
      "version": null,
      "status": "missing",
      "failure_reason": "import: ModuleNotFoundError: No module named 'pegasus'",
      "waiver_reason": null
    },
    {
      "package": "pertpy",
      "distribution": "pertpy",
      "import_name": "pertpy",
      "declared_runtime_status": "missing",
      "ref_path": "skills/scrna/scverse/refs/packages/pertpy.md",
      "version": null,